{
  "items": [
    {
      "agendaNumber": "V.-1",
      "agendaSequence": 61,
      "amountVerified": true,
      "consentSection": "general",
      "enrichment": {
        "actionType": "other",
        "category": "Budget, finance & payments",
        "headline": "Approves $25.5M in accounts payable checks for September 2020",
        "money": {
          "amountType": "cumulative",
          "direction": "expense",
          "newTotal": null,
          "priorTotal": null,
          "thisAction": 25534046.3,
          "thisActionRange": null
        },
        "schools": [],
        "subcategory": null,
        "summary": "The Board approves the district's bill payments for September 1 through September 30, 2020: 606 consolidated checks totaling $25,534,046.30. The individual payments are listed in Exhibit 1.",
        "vendor": {
          "kind": null,
          "location": null,
          "name": null
        }
      },
      "file": "20-1814",
      "flags": [
        "payment_ratification",
        "after_work_began"
      ],
      "fundingSource": null,
      "group": "Chief Business Officer",
      "id": "2020-11-12:20-1814",
      "matterType": "Report",
      "outcome": {
        "action": "Adopted on the General Consent Report",
        "adopted": true,
        "date": "2020-11-12"
      },
      "presenter": "Chief Financial Officer",
      "pulled": null,
      "review": {
        "status": "auto_ok"
      },
      "sourceIssue": null,
      "title": "Accounts Payable Warrants - Fiscal Year 2020-2021 - As of September 30, 2020",
      "vendorKey": null,
      "vendorNo": null
    },
    {
      "agendaNumber": "V.-2",
      "agendaSequence": 62,
      "amountVerified": true,
      "consentSection": "general",
      "enrichment": {
        "actionType": "other",
        "category": "Budget, finance & payments",
        "headline": "Approves $23.2M in September 2020 payroll checks and direct deposits",
        "money": {
          "amountType": "cumulative",
          "direction": "expense",
          "newTotal": null,
          "priorTotal": null,
          "thisAction": 23203977.96,
          "thisActionRange": null
        },
        "schools": [],
        "subcategory": null,
        "summary": "The Board approves district payroll for September 1 through September 30, 2020: 855 payroll checks and 7,359 direct deposits totaling $23,203,977.96. The details are listed in Exhibit 1.",
        "vendor": {
          "kind": null,
          "location": null,
          "name": null
        }
      },
      "file": "20-1817",
      "flags": [
        "payment_ratification",
        "after_work_began"
      ],
      "fundingSource": null,
      "group": "Chief Business Officer",
      "id": "2020-11-12:20-1817",
      "matterType": "Report",
      "outcome": {
        "action": "Adopted on the General Consent Report",
        "adopted": true,
        "date": "2020-11-12"
      },
      "presenter": "Chief Financial Officer",
      "pulled": null,
      "review": {
        "status": "auto_ok"
      },
      "sourceIssue": null,
      "title": "Payroll Warrants and Direct Deposits - Fiscal Year 2020-21 - As of September 30, 2020",
      "vendorKey": null,
      "vendorNo": null
    },
    {
      "agendaNumber": "V.-3",
      "agendaSequence": 64,
      "amountVerified": true,
      "consentSection": "general",
      "enrichment": {
        "actionType": "personnel",
        "category": "Staff & hiring",
        "headline": "Approves Personnel Report No. 2021-0005 from the Talent/Human Resources Department",
        "money": {
          "amountType": null,
          "direction": "expense",
          "newTotal": null,
          "priorTotal": null,
          "thisAction": null,
          "thisActionRange": null
        },
        "schools": [],
        "subcategory": null,
        "summary": "The Board approves a personnel report from the Talent department, which handles district hiring and staffing. The item text does not list the individual actions or any dollar amount.",
        "vendor": {
          "kind": null,
          "location": null,
          "name": null
        }
      },
      "file": "20-2093",
      "flags": [],
      "fundingSource": null,
      "group": "Deputy Chief, Talent",
      "id": "2020-11-12:20-2093",
      "matterType": "Personnel Report",
      "outcome": {
        "action": "Adopted on the General Consent Report",
        "adopted": true,
        "date": "2020-11-12"
      },
      "presenter": "Deputy Chief, Talent",
      "pulled": null,
      "review": {
        "status": "auto_ok"
      },
      "sourceIssue": null,
      "title": "Personnel Report No. 2021-0005 - Talent/Human Resources Department",
      "vendorKey": null,
      "vendorNo": null
    },
    {
      "agendaNumber": "V.-4",
      "agendaSequence": 65,
      "amountVerified": true,
      "consentSection": "general",
      "enrichment": {
        "actionType": "new_agreement",
        "category": "Staff & hiring",
        "headline": "Ratifies up to $56,800 for TeachBar to run test-prep classes for teacher candidates",
        "money": {
          "amountType": "not_to_exceed",
          "direction": "expense",
          "newTotal": null,
          "priorTotal": null,
          "thisAction": 56800,
          "thisActionRange": null
        },
        "schools": [],
        "subcategory": null,
        "summary": "TeachBar, an Oakland company, will hold about 2 to 3 classes each season over 12 months to help teacher candidates prepare for credential exams. It will use its own materials plus online tools from the district's Talent Division. The Board is ratifying (approving after the fact) this agreement for July 1, 2020 through June 30, 2021.",
        "vendor": {
          "kind": "organization",
          "location": "Oakland, CA",
          "name": "TeachBar"
        }
      },
      "file": "20-2013",
      "flags": [
        "after_work_began"
      ],
      "fundingSource": "Grants, Salesforce, C2T and LOcal Solutions",
      "group": "Deputy Chief, Talent",
      "id": "2020-11-12:20-2013",
      "matterType": "Agreement or Contract",
      "outcome": {
        "action": "Adopted on the General Consent Report",
        "adopted": true,
        "date": "2020-11-12"
      },
      "presenter": "Deputy Chief, Talent",
      "pulled": null,
      "review": {
        "status": "auto_ok"
      },
      "sourceIssue": null,
      "title": "Professional Services Agreement - TeachBar - Talent /Human Resources Department",
      "vendorKey": "v-004208",
      "vendorNo": "004208"
    },
    {
      "agendaNumber": "V.-5",
      "agendaSequence": 66,
      "amountVerified": true,
      "consentSection": "general",
      "enrichment": {
        "actionType": "new_agreement",
        "category": "Staff & hiring",
        "headline": "Ratifies up to $35,000 for a consultant on teacher credentialing review and mentoring",
        "money": {
          "amountType": "not_to_exceed",
          "direction": "expense",
          "newTotal": null,
          "priorTotal": null,
          "thisAction": 35000,
          "thisActionRange": null
        },
        "schools": [],
        "subcategory": null,
        "summary": "An individual contractor will prepare for a state teacher-credentialing accreditation site visit for the New Teacher Support and Development Program. She will also analyze program data, set up an advisory committee, and help hire a lead mentor. The Board is ratifying (approving after the fact) the agreement for July 1, 2020 through June 30, 2021.",
        "vendor": {
          "kind": "individual",
          "location": "Oakland, CA",
          "name": "Jennifer Bloom"
        }
      },
      "file": "20-2025",
      "flags": [
        "after_work_began"
      ],
      "fundingSource": "General Purpose",
      "group": "Deputy Chief, Talent",
      "id": "2020-11-12:20-2025",
      "matterType": "Agreement or Contract",
      "outcome": {
        "action": "Adopted on the General Consent Report",
        "adopted": true,
        "date": "2020-11-12"
      },
      "presenter": "Deputy Chief, Talent",
      "pulled": null,
      "review": {
        "status": "auto_ok"
      },
      "sourceIssue": null,
      "title": "Professional Services Agreement - Jennifer Bloom - Talent / Human Resources Department",
      "vendorKey": "v-006667",
      "vendorNo": "006667"
    },
    {
      "agendaNumber": "V.-6",
      "agendaSequence": 67,
      "amountVerified": true,
      "consentSection": "general",
      "enrichment": {
        "actionType": "mou_or_data_sharing",
        "category": "Staff & hiring",
        "headline": "Renews San Jose State University partnership for teacher intern and practicum programs",
        "money": {
          "amountType": null,
          "direction": "expense",
          "newTotal": null,
          "priorTotal": null,
          "thisAction": null,
          "thisActionRange": null
        },
        "schools": [],
        "subcategory": null,
        "summary": "This memorandum of understanding (MOU) with San Jose State University's Lurie College of Education lets the university provide intern and practicum programs for people earning teaching and student-support credentials in the district. It runs July 1, 2020 through June 30, 2023. The item text states no dollar amount.",
        "vendor": {
          "kind": "organization",
          "location": null,
          "name": "San Jose State University (Trustees of the California State University)"
        }
      },
      "file": "20-2070",
      "flags": [
        "after_work_began",
        "multi_year"
      ],
      "fundingSource": null,
      "group": "Deputy Chief, Talent",
      "id": "2020-11-12:20-2070",
      "matterType": "Agreement or Contract",
      "outcome": {
        "action": "Adopted on the General Consent Report",
        "adopted": true,
        "date": "2020-11-12"
      },